{"$schema":"https://json-schema.org/draft/2020-12/schema","$id":"https://digitalactionreceipts.com/schemas/codex-case-study-01-snapshot-1.0.0.json","type":"object","additionalProperties":false,"required":["snapshot_version","starting_commit","implementation_commits","evidence_commits","remote_head","pull_request","workflow","sbom","manifest_digest","verification_report_digest","timestamps","authorization","prohibited_actions","claims"],"properties":{"snapshot_version":{"const":"1.0.0"},"starting_commit":{"type":"string","pattern":"^[0-9a-f]{40}$"},"implementation_commits":{"type":"array","items":{"type":"string","pattern":"^[0-9a-f]{40}$"}},"evidence_commits":{"type":"array","items":{"type":"string","pattern":"^[0-9a-f]{40}$"}},"remote_head":{"type":"string","pattern":"^[0-9a-f]{40}$"},"pull_request":{"type":"object"},"workflow":{"type":"object"},"sbom":{"type":"object"},"manifest_digest":{"type":"string"},"verification_report_digest":{"type":"string"},"timestamps":{"type":"object"},"authorization":{"type":"array"},"prohibited_actions":{"type":"array"},"claims":{"type":"array"}}}
